Crop,Question,Answer
maize,"Apart from hand weeding, what other method used to weed maize",Machinery weeders are available
beans,"Apart from insecticide, what other method used to control bean weevils?",Use resistant verities and increase on water availability for crop vigor
maize,Apart from sun drying which other method used for drying maize,Use tarpaulins or cemented floor free from dust
cassava,"Apart from sun drying, what other method can I use to dry cassava",Solar driers
beans,As a farmer when should I harvest beans.,When the beans pods are yellowish green or dry brown
general,As a farmer which method is good to prevent soil erosion,Farmers can terrace their gardens or mulch their gardens to stop erosion
general,"As a farmer, How can I control pest",Spray some pests and if possible use resistant varieties
general,"As a farmer, how can I control pig weeds in the garden?",Weed when they are young and you can also spray them
general,"As a farmer, how can I know the qualities of a good fertilizer?",Check if the chemical composition can sustain crop production well
maize,At what stage of maize growth should I apply the fertilizer,Apply around planting time in the soil and on the foliage at vegetative stage before flowering
beans,At what stage should I weed the beans?,It should be three weeks after planting
maize,At what time should I spray army worms in maize,Use cultural methods
general,At what time should a farmer do watering crops.,In the evening
cassava,Brown streak is a disease but how better can prevent it?,Plant clean material
cassava,By which means does cassava reproduce,Seed after pollination
beans,Can I use chemicals to control weeds when beans are just germinating?,"No, the herbicides will kill the young beans"
cassava,Can I use chemicals to kill weeds in a cassava garden?,"Yes, there are some chemicals that are selective"
cassava,Can cassava seeds germinate if planted?,No
cassava,Can stem cutting affected by hailstorm have good yield?,No
general,Can the chemical used for storing affect seed germination?,"No, it does not affect germination"
general,Can't spraying chemicals causes environmental pollution,Yes
general,Cant spraying chemicals affect soil?,"Yes, especially uncontrolled spraying may kill none targeted organisms, can damage soil biomass and microorganisms"
cassava,Cassava and maize which one makes a person stronger?,Both can depend on how much but cassava has more calories per kilogram
cassava,Cassava and maize which one makes you stronger in food stuff?,Cassava has more calories and maize has more proteins
cassava,Do I need to put the cassava stem in the sun for some time before planting?,"Yes, it stimulates sprouting"
general,Do we have a selective pesticide for rodent?,No
cassava,Does Uganda export cassava flour to outside countries?,Yes
cassava,Does cassava have much sugar in it when testing?,Yes but not as much as sugar cane
cassava,Does cassava mosaic affect the cassava stems?,"Yes, It makes them small and not good for planting"
general,Does locusts have poison to the Crops?,No
maize,Does planting Maize on lines help to reduce soil erosion?,Yes
beans,Does spraying beans during flowering time affect it 's ability to good yield,It may if you dont spray the right chemicals
general,During what time is good for spraying,Calm weather early in the day
cassava,For how long cassava is ready to be harvested?,9-12 months
cassava,For how long cassava takes to harvest?,For majority of varieties between 9 – 12 months
cassava,For how many times should I mulch my cassava garden,Once
maize,For how many times should I weed maize?,Weeding is done every time (at least two times)there are many weeds in the garden
cassava,Give me 10 names of cassava?,"NASE 1, NASE 2, NASE 10, NAROCASS 1"
general,Give three types of soil,"Sandy,loam and clay soils"
cassava,How can CBB be managed in a field of cassava,Uproot and burn the infected materials
general,How can I avoid pest on my crops?,Use pesticides or appropriate methods of planting
cassava,How do we deal with cassava thieve?,Hire security men to be around the garden
maize,How best can I preserve my flour to avoid it becoming dark,Dry your produce on tarpaulins or cement floor away from dust and grit that would contaminate them
general,How can I add compost manure to the soil?,Spread the manure in the garden
general,How can I add manure into the Soil?,Add and plough into the soil
beans,How can I apply fertilizer in my beans garden?,Broadcast or apply near the plant
cassava,How can I apply fertilizer in cassava garden?,Apply just when planting to improve germination and vigor
maize,How can I apply fertilizer in my maize garden?,Broad cast or apply around individual plant
general,How can I apply fertilizer to the soil?,Apply around the plant if possible broadcast
beans,How can I avoid red or orange color on my bean leaves?,Use good agric practice
general,How can I conserve Soil?,Use mulches and other practices
maize,How can I control Bacterial stalk in maize plants?,Use good cropping practices
maize,How can I control stalk rot in Maize?,Use resistant varieties
maize,How can I control Bacterial stripe in Maize plants?,Use resistant varieties and increase on water availability for crop vigor
cassava,How can I control Cassava mosaic?,Use resistant varieties of cassava and manage the crop well
cassava,How can I control Nut grass in my Cassava garden?,Spray with herbicide
maize,How can I control Stewart's disease on Maize leaves?,Use good cropping practices
beans,How can I control aphids in bean plant,Spray with pesticide
maize,How can I control bacteria leaf blight in maize,Use resistant varieties
beans,How can I control bean rust,Use resistant varieties
beans,How can I control bean weeds in my store?,Use pest control chemicals recommended in stores
beans,How can I control bean weevil during storage,"Good storage practices such as using Pico bags, storing on pallets and use of insectides when combined allow for better storage iof maize"
beans,How can I control bean weevil in my dry stored beans?,Use pesticides recommended
beans,How can I control beans weevils in my store,Use insecticides
beans,How can I control beetles in beans,Use cultural methods like planting repellants
maize,How can I control brown streaks disease in maize plant,Maize doesnt suffer from brown streak. However viral disease can be controlled using improved varieties
beans,How can I control can I control mole rat in my bean,Use rodenticides
cassava,How can I control cassava bacterial blight.,Good crop management in addition to using disease resistant varieties controls diseases
cassava,How can I control cassava brown streak diseases,Use resistant varieties of cassava and manage the crop well
cassava,How can I control cassava green mites disease in my cassava.,Before planting inspect and select materials free from disease and green mites. Also use good management practices.
cassava,How can I control cassava green mites in my cassava,Before planting inspect and select materials free from disease and green mites. Also use good management practices.
cassava,How can I control cassava green mites?,Before planting inspect and select materials free from disease and green mites. Also use good management practices.
cassava,How can I control cassava leaf folding,Control pests and drought
cassava,How can I control cassava mealy bugs,Reduce on fertilizer levels and prune off infected parts.
cassava,How can I control cassava mosaic disease.,Cassava mosaic disease is controlled by the use clean planting material of resistant varieties
cassava,How can I control cassava weevils during storage?,Use chemicals
cassava,How can I control cassava white flies in my cassava garden.,Intercorpping cassava maize/spraying pesticides
beans,How can I control caterpillar eating the stems of my beans plant,Use insecticides
cassava,How can I control cockroaches in my cassava store.,Use insecticides which is approved
maize,How can I control deficiency in maize,Apply a fertilizer
beans,How can I control flies in my beans garden,Spray them or use resistant crops of the crop you are planting
beans,How can I control goat weeds in my bean garden.,Use herbicides
cassava,How can I control maintain cassava garden look health.,Good management practices and use of the right varieties
maize,How can I control maize streak disease,Use tolerant varieties and practice good practices
cassava,How can I control mole rat in my cassava,Use rodenticdes or rat poison
maize,How can I control my maize seeds from being dormant,Harvest when mature and keep well
cassava,How can I control pests from my Cassava garden,Use good crop management practices and where possible use chemicals (pesticieds) to kill the pests
cassava,How can I control pig weeds in my cassava garden.,Use the right herbicide which is recommended
cassava,How can I control scale insects in cassava garden,Apply pesticide
general,How can I control soil erosion,Farmers can terrace their gardens or mulch their gardens to stop erosion
cassava,How can I control soil erosion in cassava garden,Mulching
cassava,How can I control spear grass in my Cassava garden?,Use the right herbicide which is recommended
cassava,How can I control spider on cassava leaves,Use mitecides
maize,How can I control stalk rot in maize ?,Use resistant varieties
beans,How can I control star grass in my bean garden?,Use the right herbicide which is recommended
beans,How can I control stem borers in beans,Use resistant varieties and increase on water availability for crop vigor
maize,How can I control stringer in my maize gardens,Good crop management in addition to using disease resistant varieties controls diseases
cassava,How can I control termites eating my Cassava roots?,Use termiticides and harvest early
general,How can I control termites in my garden,Use termiticides on recommendation of the agric offcier
general,How can I control the growth of spear grass in the garden.,Weed off the weeds early and where possibble spray with the recomended herbicide
beans,How can I control the spread of beans mosaic,Use good varieties
cassava,How can I control the under ground pests like mole rats in my Cassava,Use traps or rodenticides
cassava,How can I control thief in my cassava garden,Security guarding
maize,How can I control top rot disease in my maize plants ?,Use recommended practices and cultural control practices
cassava,How can I control water longing in cassava garden?,Drain the land using terraces
cassava,How can I control water longing in my cassava garden,Use draining terraces
cassava,How can I control water longing in my cassava garden?,Use terraces
maize,How can I control weevils in my maize store,Use phsphine
beans,How can I control weeds in my bean garden,Weed regularly or use herbicides if crop is herbicide ready
cassava,How can I control weevils in the cassava store?,Use the recommended pesticides and insecticides
cassava,How can I control white flies on my Cassava leaves?,Use pestcides recommended
maize,How can I control yellowing in maize,Use resistant varieties
cassava,How can I detect cassava stem infected by cassava brown streak?,Yellowing of leaves on the plant and browning of stems that have streaks on them
general,How can I determine good yield seeds?,You can consult with the seed company for performance records
beans,How can I do away with beans weevils,Spray them or use resistant varieties
general,How can I do drip irrigating method in my garden?,Set up drips and supply water
maize,How can I do drip irrigation method to my maize garden?,Use drips available from irrigation experts
general,How can I do good crop management,Use good cropping practices
maize,How can I eliminate weeds in maize garden,Remove them by weeding
general,How can I follow rotation practice,Grow different crops as advised by the agric officer
general,How can I get clean planting materials,Approach NARO or district agric officer
general,How can I get good seeds for planting,From NARO and seed suppliers
cassava,How can I get healthy cassava cutting for planting,NARO through district based cassava seed suppliers and OWC NAADS provides healthy cuttings
cassava,How can I get healthy cassava for planting,From the district Agric officer or NARO institute
maize,How can I get ready market for my maize?,Ask the commercial officer at district
general,How can I get the percentage of humus in the Soil,Dark like color with of the soil can give you a hint on the amount of humus
cassava,How can I harvest cassava.,Uproot using a hoe
beans,How can I harvest my beans?,Pull them out of ground with hands
general,How can I identify pests and diseases in my farm,Get training from Agricultural Officer
maize,How can I identify the maize variety?,Look at its physical characteristics
general,How can I improve on crop yeild.,Use good seed and practice good crop management
maize,How can I improve on maize products,Use good varieties
beans,How can I improve on my bean products?,Use good seeds
general,How can I improve on soil sample to get better crop production.,Use fertilizers
general,How can I improve on the fertility of the soil,Use fertilizers and manure
maize,How can I improve on the nutrients in maize,Add a fertilizer in the garden
beans,How can I improve on yield of beans?,Use fertilizers and good varieties
general,How can I improve the fertility of my soil,Use fertilizers and manure
beans,How can I improve the fertility of my soil for growing beans,Use both organic and inorganic fertilizers and good management practices
general,How can I improve the fertility of soil,Applying organic mature/ planting trees
beans,How can I improve the yield of my beans,Use fertilizers in the garden
beans,How can I improve the yield of my beans?,Plant good varieties and use good agric practices
maize,How can I improve the yield of my maize,Use clean seed of resistant varieties and good agronomic practice
general,How can I improve upon the soil fertility after over land usage?,Add fertilizers
beans,How can I know a bad quality growth in beans,Poor germination
cassava,How can I know a bad quality growth in cassava,It should have at least 4 nodes and a size of diameter of about 2 cm
maize,How can I know a bad quality growth in maize,The amount of cobs on the maize
cassava,How can I know a good quality of cassava cutting for planting,It should have at least 4 nodes and a size of diameter of about 2 cm
beans,How can I know that my bean crops have excessive application of Nitrogen.,A lot of leaves on the plant
beans,How can I know that my beans are dry for storage?,The color of the pod
beans,How can I know that my beans are dry for store,Pods mature when they are yellowish and or left on the plant to mature and dry in the sun becoming brown.
beans,How can I know that my beans is dry for storage,Yellowing of pods and drying after
maize,How can I know that my maize crops has excessive application of nitrogen in it.,The amount of vegetative growth-Above normal
maize,How can I know that this maize floor is expired?,It is discolored
general,How can I know the best quality of fertilizer?,Testing it in the laboratory or soil testing
general,How can I know the fertility of my soil,Test the nitrogen content
general,How can I know the fertilizer of my soil,Testing it in the laboratory or soil testing
general,How can I know the fertilizer of soil.,By first testing the soil followed by recommendations from an expert
maize,How can I know the health maize seeds for planting.,Buy from NARO of certified seed suppliers
general,How can I maintain fertility of my land,Add fertilizers
cassava,How can I maintain my Cassava garden?,Pesticides and cultural control procedures can be mixed to control pests
general,How can I maintain soil fertility,Add fertilizers
general,How can I maintain the fertility of my Soil?,Use both organic and inorganic fertilizers and good management practices
general,How can I make compose manure.,Segregate waste and choose only organic waste which you add to dry leaves and grass and cover for about a month or two to allow it to compost and make manure
general,How can I make compost manure,Segregate waste and choose only organic waste which you add to dry leaves and grass and cover for about a month or two to allow it to compost and make manure
general,How can I make compost manure ?,Cover home waste in a pit
maize,How can I make high yielding varieties of maize crop?,Use good varieties
general,How can I make organic fertilizer,Organic fertilizer is produced by compositing home and agricultural waste and applied as per a crop recommendation
general,How can I make organic fertilizer.,Organic fertiliser is produced by compositing home and agricultural waste and applied as per a crop recommendation
general,How can I makes Artificial fertilizer?,Use chemical process
maize,How can I manage maize stalk borer in my maize garden,Spray against stem borer caterpillars when they have attacked 2 to 3 in 10 plants. Spray when they are young caterpillars on leaves and funnels.
maize,How can I manufacture maize high yielding seeds,This is the work of research institutes
maize,How can I measure the amount of fertilizer to spray I acre of the maize garden?,Application rates come with the packaging.. Read them out
general,How can I obtain the percentage of moisture in the soil sample.,Measure
general,How can I obtains the percentage of moisture in the Soil sample .,Use soil moisture meter
beans,How can I pack my bean seeds when storage.,Pack in Pico bags
cassava,How can I pack my cassava in the store.,In bags stacked to a height
beans,How can I plant my Beans?,"Prepare the garden, plant in lines at a spacing of 10 X30 cm"
cassava,How can I plant my cassava?,Dig a hole and put it there
general,How can I prepare manure.,Compost the dung into manure
general,How can I prepare manure?,Put in a place covered and let it decompose
cassava,How can I prevent Cassava green mite on cassava leaves?,Use good agric practices
cassava,How can I prevent bacterial blight,Use disease free planting material and exercise good practices such as weed removal
cassava,How can I prevent cassava leaves from hole damage,Prevent pests
cassava,How can I prevent genetically modified cassava,Ask your District Agric officer for more explanation on GMOs
maize,How can I prevent maize plant in the green?,Making constant weeding especially two times in the growing cycle
cassava,How can I prevent my cassava from hydrogen cyanide,Use improved varieties or process the flour
beans,How can I prevent pathogens in bean garden,Good cropping practices before planting
beans,How can I prevent pest and diseases in my bean garden,Use good cropping practices
maize,How can I prevent premature maize stem rotting?,Use nutrients
cassava,How can I prevent yellowish of cassava leaf.,Yellowing is mainly caused by viral diseases but lack of Nitrogen in the soil can also cuase yellowing
general,How can I promote seed germination,Use good conditions
cassava,How can I prove that My cassava is free from disease?,Test it in the lab for viruses and bacteria
beans,How can I raise good bean Crops?,Use good varieties
general,How can I reduce on the crop loses during storage.,Use pest control chemicals recommended in stores
general,How can I reduce on the over growth of weeds in my garden?,Use herbicides
general,How can I reduce on weeds in my garden,Weed every time weeds appear and cut their seeding cycle
beans,How can I regulate beans growth in my garden,Vary nutrient availability
cassava,How can I sell my cassava,Ask your district commercial officer
cassava,How can I sell my cassava.,Contact your district commercial officer
beans,How can I space my bean seeds in the garden?,60X 20 cm or 40X30 cm depending on variety
maize,How can I store maize grain on large scale?,Use tarpaulins or cemented floor free from dust and store in a well aerated shelter
general,How can I store my food.,Store in good pico bags in a cool dry place making sure that pests do not tamper with the harvest
general,How can I store useful information on Crop production and disease?,A computer or record book
general,How can I sun dry my crops at home,Put on a tarpauline or cemented floor and dry in the sun to reduce moisture
general,How can I sun dry my crops at home.,Dry your produce on tarpaulines or cement floor away from dust and grit that would contaminate them
general,How can I sundry me crops at home.,Use tarpaulins or a dry drying ground or racks
maize,How can I treat maize grain in the store,Use the recommended chemical
maize,How can I weed maize,Hand weeding or machines
cassava,How can Inter-crop cassava with beans,Plant cassava and beans at the same time
beans,How can a farmer apply fertilizer in beans garden?,Broadcasting or near the crop
maize,How can a farmer combat spider in maize garden,Use miticides
beans,How can a farmer control bean stem maggots,Use pesticides or appropriate methods of planting
cassava,How can a farmer control cassava green mite,Before planting inspect and select materials free from disease and green mites. Also use good management practices.
cassava,How can a farmer control cassava mealybugs in his or her gay?,"Several soap or oil sprays, sprayed with mealybug specific pesticide"
beans,How can a farmer control caterpillar from eating stems of beans?,Synthetic pesticides and powders can kill caterpillars but you can manually kill off the caterpillars also
maize,How can a farmer control mole rat in maize garden?,Use traps or rodenticides
maize,How can a farmer control pest and disease in maize?,Use resistant varieties
beans,How can a farmer control premature drying of bean pods,By ensuring that seeds are resistant to pest and disease
general,How can a farmer control soil erosion?,Use mulches or terraces
cassava,How can a farmer control water longing in cassava garden,Drain the soil
beans,How can a farmer control weeds in beans garden?,By using herbicides or control strategies etc
beans,How can a farmer control weevils in bean store?,Use weevil controlling insecticides
beans,How can a farmer control white flies in beans?,Use recommended pesticides and cultural control practices
cassava,How can a farmer control white flies in cassava garden?,Intercorpping cassava and maize
cassava,How can a farmer dry his or her cassava?,Use tarpaulins or cemented floor free from dust
cassava,How can a farmer improve on cassava quality,Use improved varieties from the right sources
general,How can a farmer improve on soil fertility?,Add fertilisrs and organic manure
general,How can a farmer improve on the fertility of soil?,Add fertilisrs and organic manure
general,How can a farmer kill eggs of pest before mature,Use pre emergence chemicals
maize,How can a farmer market maize products,Ask the commercial officer at district
cassava,How can a farmer plough his or her cassava garden,Use a tractor
beans,How can a farmer prepare beans garden before planting,Removing tree stumps and clearing the garden
maize,How can a farmer prevent bacteria leaf blight in maize,Use good agric practices
beans,How can a farmer prevent black spots on bean root nodules,Good cropping practices before planting
general,How can a farmer prevent cut worms,Use good cropping practices
beans,How can a farmer prevent small holes on beans leaves,Use the insecticides that deal with caterpillars
cassava,How can a farmer prevent sooty molds in cassava garden,Control all whiteflies
general,How can a farmer promote food security in Uganda,NPK mainly
general,How can a farmer protect him or her self from poison when spraying chemicals,Use protective gear
general,How can a farmer store his or her manure,By composting it
maize,How can a improve on nutrients in maize garden,Add fertilizers
maize,How can a know that maize is dry for storage,Test its moisture content
general,How can a maintain healthy seedlings,Dry them well and keep them well
cassava,How can cassava bacterial blight be controlled?,"Through pruning of infected plant tissue, weed removal, use balanced amounts of plant nutrients, allow fallow fields to dry in order to suppress disease"
maize,How can farmers process quality maize flour,Use good processing machinery
general,How can fertility of soil be improved?,Add fertiliserrs
cassava,How can increase the production of cassava,Good management practices and use of the right varieties
maize,How can l control weevils in Maize store?,Use phosphine
cassava,How can l know when to harvest my cassava?,When it has reached maturity at 12 months
general,How can make organic fertilizer?,Organic fertiliser is produced by compositing home and agricultural waste and applied as per a crop recommendation
cassava,How can manure help my cassava crops in the garden?,Improves yields
beans,How can stimulate healthy growth of beans during dry season,Use fertilisers and good varieties
cassava,How can we control CBB?,Uproot and burn the infected materials
cassava,How can we control cassava brown streak disease,Use clean seed (stems) of CBSD tolerant varieties such as NAROCASS 1 and NASE 14
cassava,How can we control cassava disease,By practicing good crop management
cassava,How can we control cassava mosaic,Cassava mosaic disease is controlled by the use clean planting material of resistant varieties
maize,How can we manufacture a quality maize flour,Dry the produce it to a low moisture and mill it into flour
cassava,How can we prevent cassava flour from getting spoiled?,Keep it well in a moisture free place
general,How chemicals are used for Crop protection?,They stop pests from attacking crops
