Crop,Question,Answer
beans,Why should I add fertilizer to the Bean plants?,Increase yields and plant performance
general,Why should I apply phosphate fertilizer at planting time?,Increase yields
general,Why should I carry out crop rotation?,It is important in improving yields and cycling nutrients
general,Why should I do mulching with the leaves?,Leaves retain water and can decompose in the soil without polluting it
general,Why should I do primary tillage?,To clear land
general,Why should I practice soil anchorage,To stop losses
maize,Why should Maize grains be dried before storage?,To reduce the possibility of growing molds
general,Why should a farmer carryout crop rotation?,It is important in improving yields and cycling nutrients
general,Why should stores for farm products have smooth pillars,To allow easy movement of storage materials
general,Would you sow the seeds which float on water?,No
beans,You are my visitor will you feel happy if I cook for you beans with food?,Yes
cassava,a heath cassava cutting should have many roots,Not necessarily
maize,a part from weeding maize which method again can I control the weeds,Use herbicides in herbicide tolerant maize
maize,after cultivating my maize during rainy season where can I keep,Leave it in the garden to dry and make a store
cassava,after how long do weevils attack stored cassava,Immediately
general,after how long should I start spraying,Spraying for diseases should be done when any economic pest is spotted but foliar fertilizers can be sprayed just before flowering
maize,am I supposed to replace a garden with local maize after planting packed maize?,"No, replace maize with a crop in a different family"
cassava,are cassava leaves edible?,Yes. As a vegetable
cassava,are cassava leaves poisonous? how much cyanide is in cassava leaves?,Some leaves are poisonous. They contain up to 1000ppm of cyanide
maize,are improved maize replantable,No if they are hybrids. However some open pollinated varieties can be replanted
maize,are improved maize replanted,Hybrids cannot be replanted
cassava,are there cassava varieties that are resistant to termites?,"No, termites eat all varieties"
cassava,are there some stems that are resistant to pests?,No
cassava,as a farmer which method of planting cassava should I use when planting cassava,Dig holes and cover it at 1X1 meter square between plants
general,"as a farmer, how can I do seed selection",Select seeds that have been certified by seed certification fees
general,as farmer which method should I use when planting,Depends on planting being done
cassava,at what stage do signs and symptoms of cassava brown streak appear on the plant?,Six months
cassava,at what stage should I apply fertilizer in My cassava garden?,At the planting stage
general,at what time does pollination take place best,When flowers are receptive to pollinators
general,at what time should I water my crops in the garden,Usually in the evenings when the evaporation is low due to heat
general,best fertilizer for crops,Nitrogen and sulfur fertilizers like NPK and SSp.
beans,by the time of planting beans what type of fertilizer should I apply,"In Uganda, the common fertility problem is lack of nitrogen so you can use nitrogen fertilizers such as NPK"
maize,can I also first soak the maize seed in water before planting?,"Yes, this brakes dormancy"
general,can I also use macozeb for spraying.,Depends on what you are controlling
cassava,can I also use mocozeb for spraying my cassava,No
cassava,can I apply fertilizer in cassava,Apply around planting time in the soil and on the foliage at vegetative stage before flowering
cassava,can I apply fertilizer when planting cassava,Yes
cassava,can I apply fertilizer when planting cassava cuttings,Yes
cassava,can I control pests and diseases in cassava by spraying?,Yes
beans,can I do re planting in beans,Yes
maize,can I hearvest maize when it has just started drying?,"No, let all the maize first dry"
maize,can I plant hybrid without spraying?,"No, hybrids are also attacked by pests and diseases"
maize,can I plant maize in a dry season,No except with irrigation
beans,can I plant trees in my beans,Yes
maize,can I put fertilizer when planting maize,Yes
cassava,can I spray cassava at any stage,Depends on what you are spraying
beans,can I spray weeds in my bean garden,Depends on what you are spraying
beans,can I use macozeb in spraying my beans,Depends on what you are controlling
cassava,can I use a chemical to kill weeds in my cassava garden?,"Yes, some herbicides are selective"
beans,can I use irrigation for beans?,"Yes, during the dry season"
maize,can I use irrigation for maize?,"Yes, irrigation is ok in dry season"
beans,can I use macozeb to spray my beans,"For fungal infections,.. May be"
maize,can I use soil to kill the caterpillars in the maize cob?,"No, soil does not kill caterpillars"
cassava,can I water my cassava garden in dry seasons?,"Yes, watering is good in dry weather"
beans,can I weed my garden only once after planting beans?,"No, you have to weed twice"
cassava,can a disease be transmitted to clean planting material if I use a knife used for peeling diseased cassava tubers,"Yes, its possible"
cassava,can a lot of plant cover affect cassava quality?,"Yes, a lot of plant cover affects cassava quality negatively"
cassava,can animals feed In cassava remains,Yes like pigs
cassava,can animals feed on cassava leaves,Yes if they are well dried
beans,can beans be pruned,No
cassava,can beans do well in same garden with cassava,Yes
cassava,can beans do well when inter cropped with cassava,Yes
cassava,can cassava be intercropped,Yes
cassava,can cassava be weeded when it develop roots,Using hands yes
cassava,can cassava cause sickness?,"Yes, if it has cyanide"
cassava,can cassava disease be carried through a stem?,"Yes, diseased stems are transported with the virus"
cassava,can cassava do well in a swamp,No
cassava,can cassava seeds be planted,Yes
cassava,can diseases remain in a cut stem?,Yes
beans,can maize be intercropped with beans,Yes
maize,can maize do well in a swap,If well drained
cassava,can mulching be done in cassava,Yes
beans,can pruning be carried out in beans,NO
maize,can pruning be done in maize,No
general,can rain water reduce power of chemical after spraying,Yes
cassava,can weeds affect the growth of cassava?,YesIt makes them small
cassava,carrying stems for fire wood can it spread further the disease,"Yes, they will reach some where and grow as virus spread"
maize,"caterpillars are eating the middle part of the maize, how can I stop it?",Spray with pesticides
cassava,do I need to dig the garden twice before planting?,"Yes, it creates a fine seed bed"
beans,do I need to replace beans with another plant the next season?,"Not really, however it's good to repalce with one from a different family to avoid same pests and diseases"
beans,do I need to wait for much rain to plant beans?,"No, planting beans should be at the start of the rains"
maize,do I put the fertilizer first before putting the maize seed,Yes or at planting
cassava,do cassava have seeds,Yes
cassava,do cassava mosaic affect only leaves,Even the roots
cassava,do cassava require pruning,Yes
cassava,do cassava seeds also germinate,Yes
cassava,do cassava seeds germinate,Yes
cassava,do l need to apply fertilizer in a cassava garden?,Not always but if the soil is limited it is advised to apply
beans,do spiders have any effect in beans,Yes some times they affect leaves and productivity
cassava,does cassava diseases affect only the leaves?,"Not really,cassava diseases affects both leaves,stems and roots.especially cassava mosaic disease and cassava brown streak disease"
cassava,does cassava green mite have any effect on the cassava tubers?,Yes it reduces yield
cassava,does cassava have seeds suitable for planting?,Cassava seeds are not suitable for planting but can germinate and be used to get cassava cuttings or stakes
cassava,does cassava have seeds?,Yes.
cassava,does cassava infections affect only the leaves?,No. Even the stems and roots
cassava,does cassava leaf infections have effects on the cassava tubers?,Yes they reduce the yield
cassava,does cassava leaves have cyanide?,Yes
cassava,does cassava mosaic affect only the leaves or even the tubers?,Makes them small
cassava,does cassava mosaic affect the cassava steams?,Affects mostly the leaves
cassava,does cassava need to be sprayed?,Mostly not
cassava,does fresh cassava add nutrition in the body?,Yes
maize,does holes on seeds affect it from germinating?,"Yes, seeds with holes may not germinate"
maize,does maize fix nitrogen in the soil,No
cassava,does prolonged drought affect cassava a lot?,Yes
cassava,does rain with stones affect cassava?,"Yes, it removes the leaves from the cassava plants and causes cassava roots to become bitter"
maize,does the yeild vary when I use hand plough and when I used something else?,"No, it does not vary as long as appropriate agronomic practices are followed"
maize,"dry maize and fresh maize, which one gives more money?",Fresh maize gives more money because the costs of post harvest handling are avoided
maize,ex which variety of maize seeds is resistant to Sunshine,"Drought tolerant maize such Longe 4, 2 etc"
beans,factors that makes beans seeds not to germinate,"Moisture, temperature and medium for growth"
maize,fertilizers used in maize,NPK and phosphate fertilizers
cassava,for how long do I need to dry my cassava before storing?,About 3 -10 days depending on theseason
general,for how long should I apply organic manure in my soil,Mainly once
cassava,for how long should I store my cassava,For planting it is about a week
maize,for how long should I take to spray my maize,Depends on what you are spraying
cassava,for how long should we use to apply manure in my cassava garden,During planting or after weeding
cassava,for how many times should I weed my cassava,Weeding is done every time there are many weeds in the garden but at least three times in the growing cycle
cassava,how can I control cassava diseases locally?,"By planting clean material, uprooting and burning diseased material"
beans,how long does it take beans to mature,Maximally 3 months
maize,how long should I keep my maize in store,About six months
cassava,how I can I store my cassava,In a clean moisture less place
cassava,how are cassava viruses caused,They spread through diseased planting material or by whiteflies
cassava,how are varieties of cassava got?,Through conventional plant breading
beans,how best can I get more yields in beans,Plant the right varieties
beans,how best can I remove bean seeds from the pod?,Dry the pods and thresh them
maize,how best can I transport maize?,it should be packed in sacks
maize,how can I control maize diseases in the garden?,"Plant early at the start of the season, practice crop-rotation, uproot or spray diseased plants"
maize,how can I store my maize,Store in good pico bags in a cool dry place making sure that pests do not tamper with the harvest
general,how can I locally test for soil fertility,Testing it in the near by laboratory or soil testing
cassava,how can I access cheaper labour for planting?,Human labour is cheaper
general,how can I access organic manure?,Use compost and rubbish from the home to make manure
cassava,how can I acquire cassava stems in time?,Make orders earlier before the period of planting reaches
maize,how can I apply fertilizer in My maize garden,Broadcasting or near the crop
beans,how can I apply fertilizer in my beans garden,Fertilisers can be applied before planting in the soil and on the foliar parts before flowering
cassava,how can I apply fertilizer in my cassava garden,You can broadcast or apply near the plant
general,how can I apply fertilizer in my garden,Apply around planting time in the soil and on the foliage at vegetative stage before flowering
maize,how can I apply fertilizer into the maize garden,Broadcasting or near the crop
maize,how can I apply organic mature in maize,Apply at the plant or around it
general,how can I apply the fertilizer in my garden,Apply around planting time in the soil and on the foliage at vegetative stage before flowering
cassava,how can I avoid cassava green mite,Before planting inspect and select materials free from disease and green mites. Also use good management practices.
beans,how can I avoid pest in beans,Good management practices
beans,how can I avoid selling at a loss?,Avoid selling immediately after a bumper harvest
cassava,how can I best control diseases in the garden?,Plant clean material
maize,how can I best dry my maize in rainy seasons?,Use a solar drier
beans,how can I best plant beans in dry weather?,By application of mulching and irrigation
general,how can I break seeds dormancy,Rub the seeds or roast them if required
cassava,how can I care for cassava in order to get good yields?,Use good seeds that are resistant to diseases and undertake good agricultural practices
general,how can I carry out crop management,Use recommended practices from agronomist
beans,how can I carry out germination test for beans,Select beans and plant in appropriate conditions. Calculate the percentage that germinates
general,how can I carry out mulching in my garden,Use grass and cover the soil
general,how can I carry out seed germination test,"Get a known number of seeds and place them in a moist place, count the number of those that germinated and those that didnt. Express it as a percentage"
maize,how can I carry out seed germination test in my maize,"Get a known number of seeds and place them in a moist place, count the number of those that germinated and those that didnt. Express it as a percentage"
general,how can I carry out seeds germination test,"Get a known number of seeds and place them in a moist place, count the number of those that germinated and those that didnt. Express it as a percentage"
maize,how can I conserve land for maize growing,Make sure you use better cropping methods
cassava,how can I control cassava bacteria blight,Use clean planting material
beans,how can I control grass hoper cutting the leaves of my beans,Use insecticides
maize,how can I control maize borer,Use insecticides or cultural control
maize,how can I control maize diseases that reduce the yeild,Good crop management in addition to using disease resistant varieties controls diseases
maize,how can I control maize. lethal necrosis,Use good agric practices and pesticides
maize,how can I control pest in my maize plant,Use pesticides and good farming practices
maize,how can I control pests in my maize garden,Use pesticides or appropriate methods of planting
maize,how can I control stinger in my maize garden,Spraying fungicides
cassava,how can I control weed s in my cassava garden,Use herbicides
cassava,how can I control weevils in my cassava,Use chemicals
maize,how can I control Birds eating my Maize grain?,Use nets and scare crows where possible guard the crop
cassava,how can I control Cassava green mite in my garden,Use recommended pesticides and cultural control practices
general,how can I control Fall army worm,Use insecticides
cassava,how can I control all the four cassava disease,Use clean planting material
maize,how can I control bacteria leaf blight on maize,Use recommended pesticides and cultural control practices
general,how can I control bacterial blight,Use resistant varieties
cassava,how can I control bacterial blight in cassava,"Weed removal, pruning of infected plant tissue, use balanced amounts of plant nutrients, allow fallow fields to dry in order to suppress disease"
beans,how can I control bean weevils,Use a good store
beans,how can I control bean weevils is in my store,Use pest control chemicals recommended in stores
beans,how can I control bird eating my bean flower?,Use scare crows
beans,how can I control black spots in beans pods,Use clean seed of disease resistant crops
beans,how can I control blight from beans,Use resistant varieties and good crop practices
beans,how can I control carterpilar eating my bean plants,Use reccomended pestcides and cultural control practices
cassava,how can I control cassava bacteria blight,Use good varieties
cassava,how can I control cassava bacterial blight,Use improved varueties and good crop management practices
cassava,how can I control cassava blight,Use improved varieties
cassava,how can I control cassava brown streak,Use clean planting material
cassava,how can I control cassava brown streak disease?,Use clean seed (stems) of CBSD tolerant varieties such as NAROCASS 1 and NASE 14
cassava,how can I control cassava green mite in my cassava,Before planting inspect and select materials free from disease and green mites. Also use good management practices.
cassava,how can I control cassava mealybugs,Use recommended pesticides and cultural control practices
cassava,how can I control cassava mosaic,Cassava mosaic disease is controlled by the use clean planting material of resistant varieties
cassava,how can I control cassava tuber rot,Plant in a clean field free from tree stumps
cassava,how can I control cassava weevil,use insecticides and store properly
cassava,how can I control cassava white flies in my cassava garden,Spray them or use resistant crops of the crop you are planting
beans,how can I control caterpillar eating the stem of my Bean plant,Use insecticides
beans,how can I control caterpillar eating the stem of my beans,Synthetic pesticeds and poweders can kill caterpillars but you can manually kill off the caterpillars also
beans,how can I control caterpillars during the flowering stage?,By spraying with pesticides
maize,how can I control caterpillars eating my maize?,Use resistant varieties and increase on water availability for crop vigor
maize,how can I control caterpillars from the maize garden?,Spray with chemicals
beans,how can I control coach grass in my beans garden,Spray with herbicide
cassava,how can I control coach grass in my cassava garden,Use herbicides
cassava,how can I control cough grass in cassava,Use the right herbicide which is recommended
maize,how can I control cut worms in my maize gardens,Use good management practices such as keeping the garden weed free and use insectcides
cassava,how can I control disease manifestation in cassava plant,Use clean planting material
beans,how can I control diseases and caterpillars in the garden?,"By spraying chemicals (pesticides), uprooting the diseased plants, using crop-rotation"
beans,how can I control diseases in beans?,By applying crop-rotation to break disease cycle
beans,how can I control diseases in my beans,Use good cropping practices
maize,how can I control diseases of maize,Doing constant weeding every time weeds show up in the gardens especially like two times during the plant growth cycle
cassava,how can I control diseases that attack the roots?,"By planting clean material, uprooting and burning diseased material"
cassava,how can I control diseases that make the cassava leaves fold?,Plant clean material
beans,how can I control flies in my beans,Use insecticides
beans,how can I control flies in my beans garden,Spray the flies or use cultural control methods
general,how can I control flies in my garden,Good crop management in addition to using disease resistant varieties controls diseases
maize,how can I control flies in my maize garden,Spraying using pesticides
beans,how can I control fungal disease in my beans,Use resistant varieties and increase on water availability for crop vigor
cassava,how can I control fusarium root in my Cassava,Remove old rooting plants
beans,how can I control grass hoppers from eating my beans,Spray before rains and when the day is not windy
beans,how can I control halo blight in my beans garden,40*30 cm or 30*70 cm depending on variety
maize,how can I control maize pests,Use good crop management practices and where possible use chemicals (pesticieds) to kill the pests
maize,how can I control maize smut,Use resistant varieties and increase on water availability for crop vigor
maize,how can I control maize weevil,"Good storage practices such as using Pico bags, storing on pallets and use of insectides when combined allow for better storage iof maize"
maize,how can I control maize weevils in my store,Take preventative steps through better management and storage and where possible use recommended insecticides. And other control strategies  
maize,how can I control maize weevils?,By storing maize in silos and by seed dressing the seeds to avoid breeding of pests
general,how can I control mealybugs,Use resistant varieties
cassava,how can I control mole rat in my cassava,Use traps or rodenticides
cassava,how can I control mole rat s in my cassava garden,Traps or rodenticide
cassava,how can I control my cassava stem during shine season,Put them under shade
cassava,how can I control my cassava stem from thief's,Put security
general,how can I control my garden tools from rusting,Use recommended pesticides and cultural control practices
maize,how can I control necuils in my maize garden?,Use insecticides
maize,how can I control needs in my maize,Use herbicides
general,how can I control over growth of weeds in my garden,Weed regularly when weeds are young
maize,how can I control peats in my maize garden,Use recommended pesticides and cultural control practices
cassava,how can I control pest and disease in cassava,Use resistant varieties or pesticides
general,how can I control pest and diseases in my garden,Use pesticides and good farming practices
beans,how can I control pest from attacking my beans,"A full cover spray with a systemic or contact insecticide, removal of all diseased plants, weeding in the first of growth"
maize,how can I control pest from my maize garden,Use pesticides and other control agents
general,how can I control pest in a garden,Controlling weeds and applying pest control chemicals will reduce pests in the gardens
cassava,how can I control pest in cassava,By spraying the garden with chemicals (pesticides)
maize,how can I control pest in maize garden,Use resistant verities and increase on water availability for crop vigor
maize,how can I control pest in my maize garden,Use resistant varieties and increase on water availability for crop vigor
general,how can I control pests and disease,Use good agric practices
cassava,how can I control pests and disease in my cassava garden,Use good crop management practices and where possible use chemicals (pesticieds) to kill the pests
maize,how can I control pests and diseases affecting my maize?,Use resistant varieties and increase on water availability for crop vigor
maize,how can I control pests and diseases in Maize,Use cultural methods like planting repellants
cassava,how can I control pests and diseases in cassava?,Use good crop management practices and where possible use chemicals (pesticides) to kill the pests
cassava,how can I control pests and diseases in my Cassava garden,Use resistant varieties or pesticides
maize,how can I control pests and diseases in the garden?,By spraying with chemicals (pesticides)
beans,how can I control pests and diseases like bean anthracnose and aphids in beans,Use good crop management practices and where possible use chemicals (pesticides) to kill the pests
maize,how can I control pests and diseases of maize,Use pesticides or appropriate methods of planting
beans,how can I control pests in beans garden,Use good agric practices
cassava,how can I control pests in cassava,Use resistant varieties and increase on water availability for crop vigor
maize,how can I control pests in maize,Use pesticides or appropriate methods of planting
beans,how can I control pests in my bean,Use good crop management practices and where possible use chemicals (pesticieds) to kill the pests
beans,how can I control pests in my beans garden,Use good crop management practices and where possible use chemicals (pesticieds) to kill the pests
cassava,how can I control rats in my Cassava store,Traps or rodenticide
cassava,how can I control rats in my cassava,Use rodenticdes or rat poison
beans,how can I control root rot in my beans garden,Treat seeds before planting and avoid stressful environments like drought in your garden
cassava,how can I control root rotting in beans,Ensure the garden is well prepared and use clean seed
cassava,how can I control rotting of beans,Use recommended pesticides and cultural control practices
general,how can I control seed dormancy,Harvest when mature and keep well
general,how can I control soil erosion in a stip,Terracing
general,how can I control soil erosion in hilly areas,Use terraces or mulches
general,how can I control soil erosion in my garden,Use terraces or mulches
general,how can I control spear grass in a garden,By spraying the weeds and also deep ploughing to cut and burn the grass
cassava,how can I control spear grass in my cassava,Use the right herbicide which is recommended
general,how can I control star grass in my garden,Use the right herbicide which is recommended
general,how can I control stem borers,Spray against stem borer caterpillars when they have attacked 2 to 3 in 10 plants. Spray when they are young caterpillars on leaves and funnels.
cassava,how can I control string in my cassava garden,"Strega can be controlled by using Strega free seeds, culturally by hand pulling or removal using hoes, you can also use resistant varieties"
maize,how can I control stringer in the maize garden,"Strega can be controlled by using Strega free seeds, culturally by hand pulling or removal using hoes, you can also use resistant varieties"
general,how can I control termites,Use termiticides on recommendation of the agric officer
