Crop,Question,Answer
general,what is the use of weediadees in my garden.,Increase performance and yield
general,what is thinning in agriculture,Removal of unwanted plants from garden
beans,what is this white thing covering the bean stem?,It is Sclerotium disease (southern blight) caused by sclerotium rolfsii
general,what is topography,Surface features
beans,what is transpiration in beans,Loss of water
general,what is water cycle,Exchange of water between systems
general,what is weeding,Weeding is the removal weeds from the garden
cassava,what is white fly,Whitefly is a white Hemipteran that typically feeds on the undersides of plant leaves.
maize,what kind of caterpillars make holes on the maize leaves?,Fall armyworm or stem borers
maize,what kind of fertilizer can I apply in maize,NPK/Urea
cassava,what kind of fertilizer should I use for planting cassava,"In Uganda, the common fertility problem is lack of nitrogen so you can use nitrogen fertilizers such as NPK"
cassava,what kind of soil is good for cassava growth,"Well drained, fertile loam soils that are deep enough to support plant growth."
cassava,what made cassava to begin routing before mature,Poor growing conditions
maize,what maize,A cereal crop that produces large grains
maize,what make maize to rot inside the comb,Lot of moisture and pathogens
cassava,what make my cassava plants to break.,Lodging
cassava,what make my cassava to put few and small Root,Poor soils and if plant is diseased
beans,what makes beans to get rotten to from its root s,A lot of rain and fungal diseases
beans,what makes beans to get dry when it still young,Bean rust and drought
cassava,what makes black leaves in cassava,Sooty mould due to whitefly infestation
cassava,what makes Cassava bitter,Hydrogen cyanide is the poison that causes cassava to be bitter
cassava,what makes I my root tubers constricted,Cassava brown streak disease
cassava,what makes a cassava plant have more than one disease?,Susceptibility to diseases
maize,what makes a farmer apply phosphate fertilizer to maize crops?,To increase yield
maize,what makes a leaf of maize to be dry,Un balanced and excessive use of chemical fertilizers and deficiency
maize,what makes a maize stem to be dry,Pest and diseases
beans,what makes bean leaf to be yellow,Viral attack or drought
beans,what makes bean leaf to fold,Pests such as attack by spiders and moths
beans,what makes bean leaves falls,Most diseases and sometimes drought
beans,what makes bean pods to rot,Water and rain and pathogens such as fungus
beans,what makes bean seeds to rot in pods,attack by diseases or too much rain
beans,what makes beans price so low here?,It's because almost every household grows beans especially in village setting and they are regarded as a crop for the poor
beans,what makes beans to dry up after flowering,Pest infestation
beans,what makes beans to produce bent seeds,Attack by pests
beans,what makes beans to shade off it's leaves.,When it is mature
beans,what makes black beans get bad so easily when kept after cooking?,Due to high protein content
cassava,what makes cassava cutting to become bigger after planting,Failure to germinate
cassava,what makes cassava flour sour,Varieties associated with high concentrations of cyanogen
cassava,what makes cassava flour to be bitter,Hydrogen cyanide
cassava,what makes cassava leaves appear yellowish,Brown streak disease
cassava,what makes cassava leaves have yellow spots,Yellow spots or y yellow leaves or allowing is mainly caused by viral diseases but lack of Nitrogen in the soil can also cause yellowing
cassava,what makes cassava leaves to be dry,Water stresses/ pathogens
cassava,what makes cassava leaves yellow,Yellowing is mainly caused by viral diseases but lack of Nitrogen in the soil can also cause yellowing
cassava,what makes cassava not grow well,Poor soil fertility and diseases
cassava,what makes cassava not to develop good yield,Poor fertility and diseases and pests attack
cassava,what makes cassava not to grow,Poor growing conditions
cassava,what makes cassava not to put tubers and yet it has grown well?,This could be due to soil factors especially over fertilization
cassava,what makes cassava plant not to grow and it's healthy.,Poor soil conditions/ pest and dieases
cassava,what makes cassava root to be rotten during rainy season,A lot of water causes proliferation of pathogens
cassava,what makes cassava root tuber rot,Cassava brown streak disease
cassava,what makes cassava roots to become black?,Cassava brown streak disease
cassava,what makes cassava stem to dry,Drought or cassava brown streak
cassava,what makes cassava taste bitter?,High cyanide content
cassava,what makes cassava to be healthy,Good soil and weather conditions
cassava,what makes cassava to be yellow,Cassava brown streak disease
cassava,what makes cassava to get dry,"Poor soils, infection of diseases an invasion of ants"
cassava,what makes cassava to have a lot of starch,Because that is what it stores only in the root
cassava,what makes cassava to rot?,Rotting of roots due to attack by fungus or water logging
cassava,what makes cassava yellow,Yellowing is mainly caused by viral diseases but lack of Nitrogen in the soil can also cause yellowing
beans,what makes flowers abortion in beans,lack of nutrients and Diseases
beans,what makes flowers to fall off in my beans,Pathogens and stressful environments like drought in your garden
cassava,what makes flowers to fall off in my cassava,Abortion of flowers
maize,what makes flowers to tall off in my maize,Poor development or drought
cassava,what makes holes on the cassava and causes it to rot?,Rats eat cassava and make it rot
maize,what makes maize fail to germinate,Poor seed viability
maize,what makes maize in suckest yield better?,They are F1 maize and are well sorted and tested for high yielding
maize,what makes maize leave sometimes yellow,Yellowing is mainly caused by viral diseases but lack of Nitrogen in the soil can also cause yellowing
maize,what makes maize leave white when germinating,Lack of chlorophyll in the leaf
maize,what makes maize leaves to be dry during rainy season,Drought
maize,what makes maize plant to high sugar concentration in the leaves,Failure to take the sugar into the cobs
maize,what makes maize seeds smaller,Poor bulking due to poor growing conditions
maize,what makes maize to be sold at a very low price sometimes?,Farmers sell their maize immediately after a bumper harvest
maize,what makes maize to dry up at early stages,Diseases especially fungal and bacteria
maize,what makes maize to have less yield,"low nutrient availability, diseases and pests"
maize,what makes maize to rot,"Soil borne pathogens such fusarium, Pythium etc"
maize,what makes maize to rot I inside the comb before harvesting,Pathogen
maize,what makes my maize leave to turn purple,Purpleness is mainly caused by viral diseases but lack of Nitrogen in the soil can also cause the colouring
cassava,what makes my Cassava leaves to loose it's shape,Cassava mosaic disease
cassava,what makes my Cassava to few and small tubers,Diseases mainly
beans,what makes my bean leaf to dry off,This could be due to attack by bean rust or drought
beans,what makes my bean leaf to have brown spots on them,Rusts
beans,what makes my bean leaves to become yellow in color,Lack of nutrients
beans,what makes my bean leaves to have brown spots?,Bean rust
beans,what makes my bean seeds to put few and rotten,Diseased planting material or poor growing conditions
beans,what makes my bean to have low yield,Environmental and disease and pest stresses
beans,what makes my bean to rot inside the pods,A lot of rain and fungal diseases
beans,what makes my beans not to germinate well,Poor varieties or seeds and stress
beans,what makes my beans not to. grow well,Poor growing conditions
beans,what makes my beans fail to put well during drier season,Drought affects the way nutrients are used in the plant
beans,what makes my beans leaf to have brown spots,Bacterial infections like halo blight disease and fungal infections like Anthracnose
beans,what makes my beans leaves to have brown spots,Anthracnose disease
beans,what makes my beans not to germinate,"The main reason for failure is a non viable (embryo destroyed, seed young or dormant etc) seed or lack of right germination conditions."
beans,what makes my beans pod to put very small seeds,Poor fertility and diseases and pests attack
beans,what makes my beans roots to rot,Pathogens and stressful environments like drought in your garden
beans,what makes my beans seeds not to germinate well,"The main reason for failure is a non viable (embryo destroyed, seed young or dormant etc) seed or lack of right germination conditions."
beans,what makes my beans to put few beans,Poor growing conditions
beans,what makes my beans to Roth in Sind The pods,Diseases and pests
beans,what makes my beans to germinate when it's. still young,A lot of moisture in the pod and late harvesting
beans,what makes my beans to germinate well,If all conditions for germination are available
beans,what makes my beans to get rot inside the pod,Rots are due to fungus and a lot of moisture or rain
beans,what makes my beans to have empty pods,Sometimes attack by pests and poor growing conditions
beans,what makes my beans to rod inside the pod,Attack by certain pests and diseases
beans,what makes my beans to rot before harvest,Fungal diseases and a lot of moisture
beans,what makes my beans to rot from the roots,Diseases called root rots
beans,what makes my beans to rot in side the pods,Pathogens and stressful environments like drought in your garden
beans,what makes my beans to rot inside the pod,A lot of rain and fungal diseases
beans,what makes my beans to wilt,Drought or pest attack
cassava,what makes my cassava to rot,Soil borne pathogens fungus
cassava,what makes my cassava fail to germinate,"The main reason for failure is a non viable (embryo destroyed, seed young or dormant etc) seed or lack of right germination conditions."
cassava,what makes my cassava flour to be Sweet,A lot of sugar
cassava,what makes my cassava flour to become bitter,Because of hydrogen cyanide
cassava,what makes my cassava not to germinate well,Poor seed material or drought or termites
cassava,what makes my cassava plant to be stunted,Lack of nutrients
cassava,what makes my cassava plant to get dry up before maturity,Disease attacks like bacterial blight
cassava,what makes my cassava plant to put few root tubers,Cassava mosaic disease/ CMD
cassava,what makes my cassava plant to put very small cassava root tubers,Poor variety or disease etc
cassava,what makes my cassava plants to put few root tubers,Cassava mosic disease
cassava,what makes my cassava root to be dry,CBSD or drought
cassava,what makes my cassava root tuber constricted,Cassava brown streak disease
cassava,what makes my cassava root tuber to be folded,When it is affected by Cassava brown streak disease
cassava,what makes my cassava seeds not grow well,Disease or poor growing conditions
cassava,what makes my cassava stem to be healthy,When they are free of disease and pest and are mature
cassava,what makes my cassava stems to have short internodes,Diseases like green mites
cassava,what makes my cassava to be dry during shine season,Loss of water
cassava,what makes my cassava to grow with little roots,Disease or poor growing conditions
cassava,what makes my cassava to put few Roots,Disease or poor growing conditions
cassava,what makes my cassava to put few and small roots tubers.,"Low yield (small tubers) is due to effect of pests/disease, lack of nutrients and other poor management practices"
cassava,what makes my cassava to put few and small tubers,Diseases mainly
cassava,what makes my cassava to put small root tubers,Lack of fertility in the soil
cassava,what makes my cassava to wilt,Attack by pests and drought
maize,what makes my maize bat to turn purple?,Maize lethal necrosis disease
maize,what makes my maize leaf to have brown spots,Fungal attack like in Turcicum leaf blight disease
maize,what makes my maize leaves to be dry,Maize lethal necrosis
maize,what makes my maize leaves to be dry at this time,Drought or disease
maize,what makes my maize leaves to be dry during shine season,Lack of water
maize,what makes my maize leaves turn yellow,Yellowing is mainly caused by viral diseases but lack of Nitrogen in the soil can also cuase yellowing
maize,what makes my maize not to germinate well,"The main reason for failure is a non viable (embryo destroyed, seed young or dormant etc) seed or lack of right germination conditions."
maize,what makes my maize plant to break from the middle of the stem,Attack by pests such as stem borers
maize,what makes my maize plants to break from the mall of the stems,Lack of nutrients like Nitrogen
maize,what makes my maize pod to have very small seeds,Poor fertility and diseases and pests attack
maize,what makes my maize put only one comb and yet other people plant and get more than one comb?,Low nutrient content in the soil and planting of low yielding variety
maize,what makes my maize seeds not to germinate well,Because of dormancy causing factors
maize,what makes my maize seeds to germinate one when have planted two seeds,One dies out
maize,what makes my maize to be torn,lack of nutrients
maize,what makes my maize to break from the middle of the stems,Attack by pests such as stem borers
maize,what makes my maize to dry,When attacked by pests
maize,what makes my maize to dry,Attack by diseases or drought
maize,what makes my maize to dry up before harvesting time,Attack by pests
maize,what makes my maize to grow taller,A lot of nitrogen
maize,what makes my maize to rust,Fungal infection
maize,what makes my maize to turn brown in storage,Because of substances in the maize that get colored on drying or loss of water
maize,what makes my maize. not to germinate well,When viability is not good
cassava,what makes my roof tubers constricted,Cassava brown streak
cassava,what makes my root tuber constricted,CBSD
general,what makes my seeds not to germinate well,"The main reason for failure is a non viable (embryo destroyed, seed young or dormant etc) seed or lack of right germination conditions."
general,what makes my soil to lose its fertility,Leaching of minerals from the soil by erosion or by removing crops
beans,what makes my the pod of my beans to be burnt,Bacterial infection
cassava,what makes old cassava leaves yellow,Cassava brown streak disease
beans,what makes other bean leaf to become yellow in color,Attack by diseases
cassava,what makes other cassava leaves to become yellow,Brown streak disease
cassava,what makes other cassava leaves to become yellow in color,Drought or cassava brown streak
cassava,what makes other cassava to be better,They dont get diseased
cassava,what makes other cassava to get rotten,Brown streak or fungal attack
cassava,what makes other cassava to grow with little roots while others having many roots,Pests and disease attack
cassava,what makes other cassavas to become week when they are growing,If they are attacked by disease and pests
general,what makes other leaves to have holes in them,Pests
maize,what makes other maize leaves to become yellow,Viral disease or drought
maize,what makes packed maize not to germinate?,Seed dormancy or poor storage of the seeds
beans,what makes people spray beans?,People spray beans after seeing pests on the leaves
cassava,what makes root tubers constricted,Cassava brown streak viruses disease
cassava,what makes some cassava dense in kilograms,The amount of starch
cassava,what makes some cassava light in kilograms,Poor growing conditions
beans,what makes the Root of My beans rot,Poor and infertile soils and lack of related nutrient to root growth during germination and growth stages of the crops in the garden
beans,what makes the bean leaf to have very small seeds,High temperatures during certain parts of the growing season maybe one of the reason for stunted bean plant.
beans,what makes the bean pod to have very small seed,Poor soil or weather conditions
beans,what makes the bean pod to have very small seeds,High temperatures during certain parts of the growing season maybe one of the reason.
beans,what makes the bean pods to have very small seeds,Effect of diseases and pests plus low nutrients
beans,what makes the beans not to germinate,Factors that promote germination like moisture and temperature
beans,what makes the beans not to germinate?,Seed dormancy and poor storage
beans,what makes the beans to have very small seeds,Poor fertility and diseases and pests attack
cassava,what makes the cassava body not to be smooth but folded?,Cassava brown streak virus (CBSV) in roots and cassava mosaic virus on leaves
cassava,what makes the cassava cover turn black?,It is the sooty moulds
cassava,what makes the cassava leaf to be folded,Have cassava mosaic disease
cassava,what makes the cassava leaf to be yellow,Cassava brown streak disease
cassava,what makes the cassava leaves have spots?,Cassava bacterial blight (CBB)
cassava,what makes the cassava leaves look folded and damaged?,Cassava mosaic virus disease (CMV)
cassava,what makes the cassava roots so segmented and bitter?,Cassava brown streak virus (CBSV)
cassava,what makes the cassava to rot?,Water logging or damage to the roots
cassava,what makes the cassava watery?,The reduction in the starch content
cassava,what makes the inner part of cassava yellow?,Starch degradation
cassava,what makes the leaves to fold and bend when growing?,Cassava mosaic virus disease (CMV)
maize,what makes the maize comb to be so small?,Nutrient deficiency
maize,what makes the maize to rot inside the comb,High moisture or pests
general,what makes the older leaves to become yellow,Loss of nutrients
beans,what makes the pod of my beans to get burnt,Bacterial attack
beans,what makes the pod of my beans to get dry,Drought and attack by diseases
beans,what makes the pods of my beans to be burnt,Blight from bacterial attack
maize,what makes the price to drop?,A bumper harvest
beans,what makes the roots of beans to dry off,Attack by diseases such as root rot
beans,what makes the roots of beans to root in the garden,"Presence of disease, floods due to heavy rainy season"
beans,what makes the roots of beans to rot,Pathogens and stressful environments like drought in your garden
maize,what makes the roots of my maize to rot,Water logging
general,what manure should I use in my garden,Green manure/ organic manure
cassava,what mates cassava to rot inside the pod,Fungal attack
beans,what mates my beans to rot from its roots,Root rot disease
beans,what mates my beans to rot inside the pod,Diseases especially fungal
cassava,what mates my cassava to shade off it's causes before maturity,Drought or cassava brown streak
maize,what mates my maize not to germinate well,Seed dormancy
maize,what mates my maize to rot from its roots,"Soil borne pathogens such fusarium, Pythium etc"
maize,what may make my maize seeds not to germinate well?,"The main reason for failure is a non viable (embryo destroyed, seed young or dormant etc) seed or lack of right germination conditions."
maize,what may make my maize seeds not to grow?,"Effect of diseases, poor soil fertility and poor pollination"
beans,what method can I use for controling pests and diseases in my beans garden,Use good crop management practices and where possible use chemicals (pesticides) to kill the pests
beans,what method can I use for controlling leaf rust in my beans garden,Use clean seed from certified dealers and practice good crop management
maize,what method can I use for planting maize,Plant in well prepared land at 30*70cm
maize,what method can I use for planting my maize in hilly area?,Use terraces
beans,what method can I use to dry beans faster,Dry on tarpaulins
maize,what method is suitable for control of the rodent in maize garden,Traps and using poison
general,what method of mulching is good for Crop?,Use compostable material
general,what methods can I use to conserve water in my beans garden,Use good cropping practices
maize,what methods can I use to control maize diseases,Use good cropping practices
cassava,what month is good for planting cassava?,April in the first season and September in the second season
cassava,what natural method can I use to control cassava mosaic,Control of whiteflies by integrated pest management or use of natural enemies
maize,what nutrient is lacking in my soil when my maize leaf yellow,Yellowing is mainly caused by viral diseases but lack of Nitrogen in the soil can also cuase yellowing
cassava,what organism causes cassava mosaic?,Virus
maize,what pest attack maize,Many including stem borers and insects etc
maize,what pest attack maize at it's early stages,Leaf hopper and cut worms and termites
beans,what pest is eating the bean stem from the bottom?,They are bean stem maggots
beans,what pesticide can I use for spraying my beans,Depends on what you want to control
maize,what pesticide should I use for spraying my maize,Depends on what you are spraying. Ask your DAO to help
beans,what process can I use when planting my beans,Prepare garden and plant at right spacing with right seeds
cassava,what products are made from cassava,"Flour, biscuits, bread, animal feed etc"
maize,what products are made from maize,"Flour, animal feed, food, starch etc"
maize,what quantity of maize can plant an acre,Recommended that you sow 10 pounds of corn seeds per acre
maize,what quantity of maize should I plant in an acre?,About 10 kg
cassava,what really makes the cassava to rot in the garden?,"Cassava brown streak disease, water logging and sometimes rats damage the roots"
maize,what should I use for harvesting my maize,Some maize harvesters are available commercially for large farms
cassava,what should I do to locusts when they are eating my Cassava leaves?,Spray them
cassava,what should I do to make my cassava grow well,Practice good agronomic practices
cassava,what should I do to make my cassava grow well in the garden,Add Nitrogen
beans,what should I do to stunted beans?,Spray them with foliar nitrogen based fertilizers. Also spray them with pesticides
beans,what should I do to the beans if the weather suddenly turns to hot or dry after planting?,Carry out mulching
general,what should I do when handling pesticide,Protect yourself from it
general,what should I do when handling chemical while spraying,Use the right gear and make sure you're protected from harmful effects of the chemical. Use right spraying equipment
general,what should I do when holding pesticides,Protect yourself from it
maize,what should I for harvesting my maize,Hands or appropriate machinery
beans,what should I s use for threshing my beans,You can beat them or use the bean thresher machine
beans,what should I start spraying my beans,Spraying for diseases should be done when any economic pest is spotted but foliar fertilizers can be sprayed just before flowering
beans,what should I use for threshing my beans,Threshers
beans,what should I use for cleaning my beans after threshing,Bean threshing machines are available
beans,what should I use for cleaning my beans.,A blower
maize,what should I use for cleaning my maize before storing,"Bacterial Wilt, Common Blight, Fusarium Root Rot, Fusarium Wilt, Halo Blight, Rust, White Mold."
maize,what should I use for harvesting my maize.,Mechanical harvesters
beans,what should I use for spraying my beans,Knapsack sprayer
beans,what should I use for threshing my beans,Mechanical threshers are available
maize,what should I use for transporting my maize during harvesting season,Motorcycle or car
cassava,what should I use for weeding cassava plants?,Farm implements like hoes
maize,what should I use threshing my maize,Threshers are available
cassava,what should l do so that l stop cassava mosaic in cassava garden,Cassava mosaic disease is controlled by the use of clean planting material of resistant varieties
maize,what should l use for transplanting my maize,Transplanters are available
cassava,what shows that the cassava is heathy,It has many leaves and is growing well
cassava,what size of cassava cutting should plant,A medium size stem of about 9 to 15 months is approriate for planting
cassava,what size of cassava cuttings should I plant?,About 30 cm size
cassava,what size of cassava stem should I cut for planting,About 10-15 cms long and 2 cm in diameter
cassava,what size of cassava stem should I plant in a hole?,10-15 cm
cassava,what soil type is good for planting cassava,Loam
cassava,what spread brown streak?,They are white flies
cassava,what spread cassava mosaic in the garden,Whiteflies mainly
beans,what stage is the best for spraying beans?,The best time is before flowering stage
cassava,what stem is good for planting in this region?,Narocas1
maize,what storage of maize growth should I. apply the fertilizer,At planting and during vegetative phase
cassava,what the fertilizer can I use in cassava,Nitrogen fertilizers
general,what time does pollination take place most,During morning hours stigma are receptive
cassava,what transmits cassava mosaic virus disease,Cassava mosaic disease is caused by cassava mosaic virus which is mainly spread by whiteflies and use of diseased planting material
maize,what type of fertilizer can I use for spraying my maize,Depends on what you are spraying
beans,what type of bean seeds are the best for growing,Bean varieties are tolerant to bean diseases like those with medium seeds and Nabe 15
maize,what type of fertilization occurs in maize,NPK and phosphate fertilizers
