Crop,Question,Answer
general,what is crop rotation,A management practice of Growing different crops on the same field in consecutive seasosns. It is important in improving yields and cycling nutrients
general,what ls crop rotation,The growing of different crops on the same piece of land in different seasons
general,what should I do when handling the chemical,Protect yourself from it
maize,what should I use for. transporting my maize during harvesting,A truck if produced in large quantity
cassava,what acids are found in cassava,No acid in cassava
general,what adjustment can I do to improve yields of my produce,Use clean seed of resistant varieties and good agronomic practice
beans,what affects beans in early stages?,Pests and diseases
maize,what are Stewart's diseases in maize,The disease that causes lesions on maize and is caused by bacteria
cassava,what are brown streak virus in Cassava,Viruses that cause browning of leaves and roots in cassava
cassava,what are cassava viruses,Virus which attack cassava
maize,what are characteristics of high yielding Maize,Many cobs/seeds
beans,what are common beans disease,"Bacterial Wilt, Common Blight, Fusarium Root Rot, Fusarium Wilt, Halo Blight,Rust, White Mold."
beans,what are common condition favorite for growing my beans,Loamy soils and in the right season when there is rainfall
maize,what are common disease in maize,Viral and bacterial diseases
general,what are crop nutrients,Materials that improve crop growth
general,what are crop pests,Animals or insects which spoil crops
general,what are examples of leguminous plants,"Beans, soya beans etc"
maize,what are factors that affect maize growing,Poor growing conditions
cassava,what are fusarium root in Cassava,Fungal infection causing rotting
cassava,what are good stages of spraying cassava,Depends on what you are spraying
maize,what are good stages of spraying maize,Vegetative stage
general,what are legumes,Crops such as beans and soya beans which are nitrogen fixers
maize,what are maize pests,"Termites, Leaf hoppers, stem borers, cut worms, etc"
general,what are micro organism,Small organisms
general,what are pests,Insects or animals that eat crops
maize,what are precautions taken while handling herbicide into the maize garden,Protect yourself from it
general,what are qualities of good seeds for planting,High viability
beans,what are rust in beans,"Fungal diseases affecting bean leaves, pods etc"
general,what are seed companies and urban traders,People who trade in agricultural produce
general,what are seeds dormancy,Failure to germinate
cassava,what are signs of the mosaic disease in the Cassava,Folding of leaves and low yield
cassava,what are some of the signs of cassava mosaic disease,Folding of leaves
cassava,what are the distance of cassava planting,1X1Meters
general,what are the activities carried out under primary tillage?,Removing tree stumps and clearing the garden
general,what are the advantages of using Organic mulches when planting crops?,They easily decompose
general,what are the agents of pollination?,"Insects, water, air, wind"
general,what are the agricultural practices?,Good ways of practicing agric
cassava,what are the agronomic practices of cassava,"Timely planting, timely weeding, spraying with pesticides, soil anchorage"
beans,what are the beans pests,"These include moth, caterpillars etc"
maize,what are the best soil for maize,"Well drained, fertile loam soils that are deep enough to support plant growth."
cassava,what are the better ways of planting cassava seeds than cassava stems,Seeds are sowed
general,what are the challenges in crop spacing,Reduce of yield
general,what are the characteristics of a well drained fertile soil,Good aeration
beans,what are the characteristics of high yeilding beans,They put on many seeds
cassava,what are the characteristics of resistant cassava varieties,They dont get diseased
beans,what are the common types of beans,Climbing and bush type beans
cassava,what are the common types of cassava,There is local and improved cassava varieties. Improved varieties may be resistant to pests and diseases
cassava,what are the common types of cassava diseases,"Bacterial Wilt, Common Blight, Fusarium Root Rot, Fusarium Wilt, Halo Blight,Rust, White Mold."
maize,what are the common types of maize,White maize and popcorn maize
maize,what are the common types of maize pests,"Stem borers, fall army worm, termites, etc"
maize,what are the common weeds in a maize garden,"Couch grass, wandering jew, etc"
general,what are the components of Soil?,"Organic matter, water, minerals and microorganisms"
general,what are the components of sprinkler irrigation system?,"A sprinkler, a delivery pipe and a pump"
beans,what are the conditions that favors the growth of beans,Good soil and weather conditions
cassava,what are the conditions that favors the growth of cassava,Good soil and weather conditions
general,what are the dangerous of soil erosion,Loss of nutrients and environmental degradation
general,what are the dangers of pests to the crops,They reduce yield
general,what are the disadvantages of crop rotation,It may lead to accumulation of pests
maize,what are the effects of weeds in the garden?,"Weeds competite for nutrients, space and habour pests"
cassava,what are the elephant weeds in my Cassava garden,It is a weed that needs to be removed
general,what are the environmental tractors that makes the soil to be infertile,Soil erosion and leaching of minerals
cassava,what are the examples of weeds in cassava crops.,Couch grass
beans,what are the factors affecting seed germination in beans,"Moisture, temperature and nutrients"
beans,what are the fertilizers used in beans,Adding in low nitrogen fertilizers at planting time is ok though usually beans manufacture their own nitrogen directly from the soil.
cassava,what are the good practices when weeding cassava?,"Do not dig deeper to cut cassava roots, extend the soil to the root area"
cassava,what are the good season of planting cassava,Rainy season
maize,what are the good season to plant maize,The August November season
cassava,what are the good stems for planting,"Stems with no streaks, with buds, mature enough"
cassava,what are the importance of cassava leaves?,Food and vegetable
general,what are the importance of crop rotation,It is important in improving yields and cycling nutrients
maize,what are the importance of soil moisture in the growth of maize crop.,Allow for successive completion of crop life cycle
general,what are the importance's of shifting cultivation,Not many it just allows the soil to rest
beans,what are the major diseases in beans,"Anthracnose , angular leaf spot , rust and common bacterial blight"
cassava,what are the measures of preventing brown streak disease?,Use resistant varieties of cassava and manage the crop well
maize,what are the method l should use when applying fertilizer in my maize garden,Broadcasting or near the crop
maize,what are the method of applying fertilizer in the maize garden,Broad casting
general,what are the method of removing the weeds in my garden,Weeding or using herbicides
maize,what are the methods of harvesting Maize Crop?,Hand harvesting mainly
cassava,what are the methods of land preparation for planting cassava?,Digging and mounding the land or digging holes
general,what are the objectives of primary tillage?,To easily prepare land
beans,what are the pest of beans,"Depending on the stage of growth, they include bruchids, stem maggots, several types of flies, thrips, bettles, pod borers, sap sucking insects etc"
cassava,what are the pests of cassava crop,"Whiteflies, green mites, goats, pigs etc"
maize,what are the pests of maize,"Stem borers, fall army worm, termites, etc"
cassava,what are the processes of preparing cassava,Harvest-Peel-Chop and prepare either fresh or dry and make four
cassava,what are the purposes of growing cassava,Food and income security
general,what are the qualities of a good fertilizer?,It should be able to be easily absorbed by plants
general,what are the qualities of a good store?,Cool and dry
cassava,what are the quality of good cassava plant,"A good cassava plant should have no disease, many nodes and be able to yield highly"
cassava,what are the side effects of cassava leaf infections to the root tubers?,Low productivity is registered
cassava,what are the side effects of planting trees In a cassava garden,They shade leaves and reduce yield
maize,what are the side effects of using chemicals for spraying?,"They get absorbed by the plants and are deposited in plant tissues, they can be poisonous to the one spraying also"
cassava,what are the signs and symptoms of Cassava bacterial wilt,Spots on leaves
beans,what are the signs and symptoms of the common Blight in beans,Water soaked angular peats on the leaf
cassava,what are the signs of Cassava green mite diseases,Folded leaves at the top
beans,what are the signs of anthrocnose,Angular reddish-brown spots on leaves with veins
cassava,what are the signs of bacterial blight in cassava plant?,The stems look dried while the leaves wilt and have brown spots on them
cassava,what are the signs of cassava brown streak?,Brown or yellowing older leaves and necrosis on the roots
cassava,what are the signs of cassava green mite?,Bunchy top character of the stem and green dots on leaves
cassava,what are the signs of cassava mosaic,Folded leaves
beans,what are the signs of the Southern Blight in the beans,Yellowing of foliage with a slight darkening of stem
general,what are the solutions to the farms who can not have access to good variets,The best solution is to contact the nearest office of NARO for the best advice
beans,what are the spacing for beans,60cm (between row) and 20cm (between plants)
maize,what are the spacing for maize,"Depending on variety, it can be 40cm by 35cm or 75cm by 25cm."
beans,what are the spacing of beans,60cm (between row) and 20cm (between plants)
cassava,what are the spacing of cassava,1X1 meter
beans,what are the stages of applying fertilizers in beans,At cropping and at flowering
cassava,what are the stages of weeding cassava,Whenever weeds appear
general,what are the steps involved in soil preparation?,Removal of stumps followed by 1st and second ploughing
cassava,what are the strategies for controlling cassava mosaic disease virus,Use resistant varieties of cassava and manage the crop well
cassava,what are the symptoms of Cassava bacterial blight,Holes on the leaves are the most visible
cassava,what are the symptoms of cassava mosaic,Folded and slightly light green leaves
cassava,what are the symptoms of cassava mosaic disease?,Curled leaves and die back of the stem plus very little or no roots after harvest
cassava,what are the symptoms of cassava poisoning?,Vomiting and convulsions and pain in stomach
cassava,what are the symptoms of fusarium root in Cassava,Yellowing and wilting
general,what are the type of germination in plant?,Epigeal and hypogeal
beans,what are the types of diseases of beans,Fungal and bacterial diseases
general,what are the types of germination,Epigeal and hypogeal germination
beans,what are the use of Root nodules in my beans plant,To fix Nitrogen
cassava,what are the uses of cassava?,Food and income security
cassava,what are the varieties of cassava,NASE and NAROCASS series
maize,what are the varieties of maize?,"Bazooka, Longe 1, longe 3, longe 4, longe 2H, longe 5, etc"
general,what are the ways in which soil loses its fertility?,Poor cropping practices
general,what are the ways in which weeds are classified?,Perennial and annual weeds
beans,what are these flying things that are eating the flowers?,They are flower beetles and flower thrips
maize,what are these long small caterpillars eating the maize in my garden?,Fall armyworm or stem borers
beans,what are these white things that form on the stem?,It is Sclerotium disease (southern blight) caused by sclerotium rolfsii
general,what are weevils,Weevils are insects that damage grains
cassava,what are white flies,Whiteflies are Hemipterans that typically feed on the undersides of plant leaves.
cassava,what attacks the cassava stems and puts watery things on it?,They are scale insects
general,what attracts pollinators in my garden,Flowers produce attractants
beans,what beans variety is drought tolerant,NAROBEANS
beans,what best method can I use to water my beans,Irrigation and field flooding
maize,what brings a hole from maize,Fall army worm or stem borers
cassava,what brings brown streak disease in cassava.,Whiteflies spread the disease but also mainly through infested/infected cassava stems
cassava,what brings cassava plant brown streak disease.,"Whiteflies and infected stems carry A virus called cassava brown streak virus found in tissues of cassava, especially stems causes the disease"
cassava,what brings diseases on the roots?,Cassava brown streak virus (CBSV) affects all part of the cassava
cassava,what brings in white fly in a cassava garden,Whiteflies come from neighbouring gardens and plants and infest your field
beans,what brings the flies in my beans garden,Eggs from pests
cassava,what brings very small flies in my cassava garden,"Failure to spray with effective insecticide, poor field sanitation i.e. failure to completely destroy previous crop debris."
general,what brings very small flies in my garden,Flies are eggs that have hatched from insects infesting your garden
cassava,what brings worms in the inner part of the cassava root?,"Naturally nematodes parasites eat the plant roots but when the root is damaged by the virus, worms easily get in through the damaged part"
cassava,what can I control male rat in my cassava,Use rodenticides
cassava,what can I do if my cassava garden is affected by mosaic disease,If possible up root and plant new good seeds as the yield will be miserable
cassava,what can I do in order to improve the yields of cassava?,Use good planting material of resistant varieties
beans,what can I do to avoid my beans from getting dry,Watering during dry season/ planting seeds at the bringing of the rain seasons
cassava,what can I do to control cassava mosaic,Cassava mosaic disease is controlled by the use clean planting material of resistant varieties
cassava,what can I do to control cough grass in cassava,Use the right herbicide which is recommended
beans,what can I do to make my beans put good seeds,Plant better varieties
cassava,what can I do to make my cassava grow well,Undertake good agric practices
beans,what can I do to make the folded leaves open?,"If it is due to a viral disease, there is no way because there is no solution yet for the viral diseases especially in healing the already sick plant."
cassava,what can I do to prevent spear grass in my cassava garden,Spray with herbicide
general,what can I do to prevent spear grass in my garden,Use herbicides
cassava,what can I do to prevent weeds in my cassava garden,Use herbicides
beans,what can I do when my beans are flowering,Spray some foliar fertilizer
cassava,what can I do with my cassava stem after cultivating,You can sell them as seed or use them as firewood
beans,what can I use for cleaning my beans after threshing,Mechanical threshers are available
cassava,what can I use for drying My cassava,Dry your produce on tarpaulins or cement flor away from dust and grit that would contaminate them
cassava,what can I use for drying My cassava a part from shine,Solar driers
maize,what can I use for harvesting maize,Manually Harvest or use machines
maize,what can I use for planting maize,Nitrogen fertiliser and farm implements like hoes
beans,what can I use for planting my beans,NPK and phosphate fertilizers
cassava,what can I use for planting my cassava,Hoe
cassava,what can I use for planting my cassava cuttings,Use a hand hoe
maize,what can I use for planting my maize,Fertilizer from chemicals
beans,what can I use for safe driving my beans,Beans can be dried on tapaulines on cemented floor to avoid losses in quality
beans,what can I use for safe drying my beans,A cool dry place
maize,what can I use for safe drying my maize,Dry your produce on tarpaulines or cement floor away from dust and grit that would contaminate them
beans,what can I use for safe drying of my beans,Beans can be dried on tapaulines on cemented floor to avoid losses in quality
beans,what can I use for seed dressing beans,Appropriate and recommended chemicals
beans,what can I use for spraying beans?,One can use a knapsack sprayer
cassava,what can I use for spraying cassava mosaic virus,"No need to spray, Clean seed"
maize,what can I use for spraying this caterpillars in the maize garden?,Use pesticides
cassava,what can I use for storing my cassava.,Store in good pico bags in a cool dry place
beans,what can I use for threshing my beans,Wooden pieces and threshing floor. Machines are available
maize,what can I use for transporting my maize from the garden during harvesting,Bicycle or wheel barrow etc
maize,what can I use for. transporting my maize from the garden during hervesting,Use of pico bags or sacks that are aerated
beans,what can I use storing my beans,Dry storage is required probably cemented away from moisture and pests.
beans,what can I use to control birds from digging out the planted seeds?,"By scaring the birds using the scare craws, also by physically chasing away the birds from the gardens of beans"
maize,what can I use to control caterpillars eating the middle part of the maize plant?,Spray with chemicals
cassava,what can I use to control diseases making cassava leaves yellow?,Plant uninfected plant material
maize,what can I use to control maize diseases?,"Crop-rotation, planting seeds from certified seed companies"
cassava,what can I use to control weeds in my cassava during rainy season,Herbicides
maize,what can I use to dry my maize?,Use a solar drier
cassava,what can I use to spray cassava with brown streak,Insecticides that kill anthropod pests such as whiteflies can be used in case of so many whiteflies in the garden which spread the disease
cassava,what can I use to spray cassava?,"Most chemicals are good for example Rocket, cypermethrin, dudu cyper, imidacloprid, etc"
maize,what can I use to spray maize to get good yields?,One can use amdox
maize,what can I use to stop monkeys from eating my maize?,Tie dogs around the garden
cassava,what can I use to store my Cassava,Pico bags
cassava,what can be wrong with the stem if it doesn't germinate after two weeks?,It is either rotting or it is destroyed by termites
cassava,what can bring cassva diseases,"Planting unclean plant material, whiteflies"
cassava,what can l use for drying my cassava,Use tarpaulines on raised racks in the sun
maize,what can make my maize seeds not to germinate well?,Poor viability
cassava,what can use to spray cassava with mosaic,nothing. No spraying can remove virus
general,what can we do to prevent weeds in our garden,Weed early
cassava,what cassava mosaic,"Cassava mosaic disease is caused by cassava mosaic virus which is mainly spread by whiteflies and use of diseased planting material. To avoid it, use clean planting material of resistant varieties"
cassava,what cassava whiteflies,Whitefly are white Hemipterans that typically feed on the undersides of plant leaves.
maize,what caterpillar is eating the middle part of maize?,Fall armyworm or stem borers
maize,what caterpillars are affecting maize in the garden?,They are fall army worms and stem borers
beans,what caterpillars eat the bean flowers?,They are cut worms
beans,what causes falling of been leaves,Viral diseases
maize,what causes premature yellowing and drying of maize leaves,Yellowing is mainly caused by viral diseases but lack of Nitrogen in the soil can also cause yellowing
maize,what causes premature. yellowing. and. drying of maize leaves,Viral diseases
cassava,what causes Cassava brown streaks disease,"A virus called cassava brown streak virus found in tissues of cassava, especially stems causes the disease"
cassava,what causes Cassava soft rot,"Soil borne pathogens such fusarium, Pythium etc"
cassava,what causes Cassava yellowish,Yellowing is mainly caused by viral diseases but lack of Nitrogen in the soil can also cuase yellowing
maize,what causes Stewart's diseases in my maize,A Bacteria
cassava,what causes The stem tuber to become bigger than others,Its capacity to take in nutrients
beans,what causes a beans seeds to be rotten,"If stored in a moist place, the seeds absorb moisture and rot"
beans,what causes anthracnose in beans,It is caused by fungus
beans,what causes bean stem maggots,Beetles that lay the maggots and moth
beans,what causes bean weevils in my store,Weevils are a result of improper crop management pre and post harvest. Good control and management strategies will reduce weevil infestation
beans,what causes beans rot crop,Pathogens arising from moisture build up
beans,what causes beans rust,Fungal attack
beans,what causes beans seeds to have holes,Weevils are insects that damage grains
maize,what causes black dusting spread on Maize leaves?,Use of diseased planting material and poor crop management practices
cassava,what causes black spots in cassava,Brown streak
maize,what causes black spots in my maize garden,Fungal attack
beans,what causes black spots on beans pods,Fungal or bacterial diseases
beans,what causes black spots on my bean,It happens when pores of the fungus germinate and infect individual plant cells.when this happens the sorrouning cells die and the fungus can not advance thus resulting into ablack spot on the bean pod
maize,what causes black swelling of Maize seeds?,Smuts
beans,what causes blade spot on my been pod,Bacteria infections
cassava,what causes blight in cassava,Bacteria called Xanthomonas
cassava,what causes cassava fusarium wilt.,Fusarium as the pathogen
cassava,what causes cassava green mite,Insects that attack the cassava plant
cassava,what causes cassava infections at early stages of cassava growth?,Use of poor and diseased planting material
cassava,what causes cassava leaf to get dry,Could be disease or drought
cassava,what causes cassava steam same time swollen,Failure to germinate
cassava,what causes cassava to be yellow,Cassava brown streak disease
cassava,what causes cassava to become like gridend even when its in store?,Cassava weevils
cassava,what causes cassava to grow short maturity,Nutrient deficiency
cassava,what causes cassava to rot in the garden?,Cassava brown streak virus (CBSV) or water logging
cassava,what causes cassava tuber constricted,Cassava brown streak disease
cassava,what causes cassava white mite,Insect pests attack plants usually when they are abundant and cause yield losses. They are caused by changes in environment etc
maize,what causes cross pollination in maize plants?,Insects and wind
cassava,what causes difference in growth pattern of cassava in the same garden?,"Prevalence of devastating pests/diseases, use of varieties with low adaptation rates and low genetic potential"
general,what causes diseases in plants?,Vectors and parasites
beans,what causes drying of the whole beans plant,Bacterial and fungal diseases
beans,what causes dryness of bean leaves,Drought or disease
beans,what causes flowering in bean plants?,Flower
maize,what causes flowers absorption in maize,"Diseases, pests and even environmental conditions like drought"
beans,what causes flowers to off in my beans,Attack by pests and a lot of moisture
beans,what causes folded leaves in beans,Pests such as leaf miners etc and viral diseases
beans,what causes folding of beans leaves,Pests can fold beans but viral diseases are the main cause
cassava,what causes hydrogen cyanide in cassava,It is a chemical in cassava which protects it
general,what causes land fragmentation?,Land pressure and high populations
beans,what causes leaf rust in beans,Fungal spores spread on leaf surfaces
general,what causes low rate of transpiration in plant growing,High humidity in the air
cassava,what causes low yielding in cassava,Poor seeds and poor soils
beans,what causes low yielding of beans,Loss of fertility
cassava,what causes low yields in cassava?,Pests and diseases
beans,what causes lower abortion in beans,Diseases mainly
maize,what causes maize bacterial stripe,Bacteria
maize,what causes maize not to grow,Lack of nutrients
maize,what causes maize steak diseases,Viruses
maize,what causes maize to grow short maturity,Drought
maize,what causes my maize to grow short and fail to put on Combs with seeds,Lack of fertility in the soil
maize,what causes my maize to grow short and tails to put on comb with the seeds,Poor fertility and diseases
maize,what causes over growth of weeds in my maize garden?,A lot of nutrients
beans,what causes pod rotting in beans,Fungal diseases mainly
general,what causes poor crop stand to farmers?,Poor seeding
general,what causes poor fertility of the garden soil?,Leaching of nutrients
maize,what causes premature yellowing and drying of maize leaves,Viral diseases and loss of nutrients
cassava,what causes premature  yellowing of cassava leaves,CBSD or drought
maize,what causes purpling of maize leaf,MLN disease
maize,what causes purpling of maize leaves,Viral diseases such as MLN and lack of nutrients
cassava,what causes root cassava having parallel back lines?,Post harvest decay
beans,what causes root rotting in beans,Pathogens and stressful environments like drought in your garden
cassava,what causes root rotting in cassava,Infections caused by casava brown streak an cassava mosaic disease caused by a virus spread by whitefly an planting of dieased material
cassava,what causes rotten of cassava in the gardens before harvesting,Fungal attack
